{
  "schema_version": "1",
  "request_id": "req_view_001",
  "expected_revision": 3,
  "expected_view_revision": 1,
  "interaction_epoch": 2,
  "control_ticket": "tkt_epoch2_rev3",
  "action": "set_view",
  "params": {
    "camera": {
      "yaw": 24.5,
      "pitch": -8,
      "zoom": 1.4
    }
  }
}
